{
  "id": "exhibition-catalog-to-sales-site",
  "version": 1,
  "scope": "system",
  "title": "Exhibition catalog → sales site",
  "goal_template": "{goal}",
  "user_value_template": "Задеплоенный сайт-каталог участников выставки: компании обогащены (ИНН/финансы/сайт), проверены по реестрам и санкционным спискам, классифицированы target/near-target/not-target, сайт собран и задеплоен.",
  "defaults": {
    "max_attempts": 3,
    "execution_timeout_seconds": 900,
    "recovery_policy": "default"
  },
  "stages": [
    {
      "id": "discover",
      "title": "Discover — найти каталог участников",
      "steps": [
        {
          "title": "Найти страницу каталога участников и зафиксировать CATALOG_BASE",
          "instructions": "Искать /participants, /exhibitors, /companies, /catalog; проверить digital-поддомены (catalog., digital., expo.), где лежат сайты/почты компаний; определить базу каталога и способ пагинации. Если каталог не найден — честное сообщение, а не выдуманный список.",
          "execution_kind": "agent",
          "executor_role": "researcher",
          "minimum_model_level": "bachelor",
          "context_budget": "small",
          "validation": { "catalog_source_found_and_base_fixed": true }
        }
      ]
    },
    {
      "id": "scrape",
      "title": "Scrape — спарсить список участников",
      "steps": [
        {
          "title": "Скрапить и дедуплицировать список компаний",
          "instructions": "Собрать имя бренда, стенд/секцию, href в digital-каталоге, страну. Поддержать Tilda T-Store API, HTML-страницы, JS-массив EX. Нормализовать имена (HTML-entities, lowercase, не-алфанум).",
          "execution_kind": "programmatic",
          "validation": { "file_exists": "participants.json" }
        }
      ]
    },
    {
      "id": "enrich",
      "title": "Enrich — ИНН, финансы, сайт",
      "steps": [
        {
          "title": "Обогатить каждую компанию через DaData и Checko",
          "instructions": "По названию — ИНН через DaData (suggest/party); по ИНН — юрлицо, ОКВЭД, регион, статус, финансы и ОГРН через Checko; со страницы каталога — сайт и email. Параллельно с таймаутами. Недоступность API не валит прогон — компания остаётся с nt-кандидатом. Для Checko-ссылки сохранять ОГРН, не ИНН.",
          "execution_kind": "programmatic",
          "validation": { "file_exists": "company-results.json" }
        }
      ]
    },
    {
      "id": "registry",
      "title": "Registry — санкции и официальный реестр (ДО классификации)",
      "steps": [
        {
          "title": "Проверить каждую компанию по санкционным спискам и ЕГРЮЛ/ФНС",
          "instructions": "Для каждой компании с ИНН/ОГРН определить registry_status (ok / sanctioned / not_found / inactive / unknown) и источник проверки; записать результат в registry-status.json. Реестр недоступен — явный unknown, а не «молча ok». Выполняется СТРОГО ДО классификации target/near/not-target.",
          "execution_kind": "programmatic",
          "validation": { "file_exists": "registry-status.json" }
        },
        {
          "title": "Разобрать пограничные реестровые совпадения",
          "instructions": "При неоднозначном совпадении по названию/ИНН разобрать вручную: подтвердить или опровергнуть санкционную/недействующую связь. sanctioned и inactive не могут получить t:1 ни при каких условиях.",
          "execution_kind": "agent",
          "executor_role": "researcher",
          "minimum_model_level": "bachelor",
          "context_budget": "small",
          "validation": { "sanctioned_and_inactive_blocked_from_target": true }
        }
      ]
    },
    {
      "id": "classify",
      "title": "Classify — target / near-target / not-target",
      "steps": [
        {
          "title": "Классифицировать тип и выручку",
          "instructions": "4a тип: страна, ОКВЭД (13.x/14.x — производитель; 46.x/52.x/73.x — торговля/сервис), слова-маркеры. 4b выручка (млн руб): unknown → nt:1; < 150 → nt:1; 150–1000 → t:1; 1000–5000 с прибылью ≤ 100 → t:1; > 5000 → nt:1. Жёсткие правила: NO INN = NO t:1; near_candidate → максимум nt:1; неизвестная выручка → nt:1; Belarus ≠ target; реестровый флаг sanctioned/inactive блокирует t:1.",
          "execution_kind": "programmatic",
          "validation": { "command_exit_zero": "python3 scripts/classify.py" }
        },
        {
          "title": "Обосновать пограничные классификации",
          "execution_kind": "agent",
          "executor_role": "researcher",
          "minimum_model_level": "master",
          "context_budget": "medium",
          "validation": { "borderline_classification_justified": true }
        }
      ]
    },
    {
      "id": "assemble",
      "title": "Assemble — собрать EX-массив",
      "steps": [
        {
          "title": "Собрать EX-массив записей компаний",
          "instructions": "Для каждой компании — {id, n, t, nt, inn, ogrn, w, e, href, ru, rev, prof, ry} плюс реестровый статус (registry_status, источник). b (описание) для целевых пишется вручную. ogrn обязателен для Checko-ссылки.",
          "execution_kind": "programmatic",
          "validation": { "command_exit_zero": "python3 scripts/build_ex.py" }
        }
      ]
    },
    {
      "id": "site",
      "title": "Site — построить HTML-сайт",
      "steps": [
        {
          "title": "Собрать сайт из шаблона (bracket-match write-back)",
          "instructions": "Скопировать шаблон, заменить title, CATALOG_BASE, EX-массив и футер. Запись EX — bracket-match write-back, никогда regex с .*?. Обязательные фичи: isNear, фильтр «Почти целевые», near-badge, CSS-переменная --nrt, Checko-ссылка по ОГРН, filterHint/updateFilterHint.",
          "execution_kind": "programmatic",
          "validation": { "command_exit_zero": "python3 scripts/validate_site.py" }
        },
        {
          "title": "Написать описания b для целевых компаний",
          "execution_kind": "agent",
          "executor_role": "developer",
          "minimum_model_level": "master",
          "context_budget": "medium",
          "validation": { "target_company_descriptions_written": true }
        }
      ]
    },
    {
      "id": "deploy",
      "title": "Deploy — задеплоить сайт",
      "steps": [
        {
          "title": "Задеплоить через wrangler pages deploy",
          "instructions": "Только после успешного validate_site.py. Новый или существующий проект; вернуть рабочий URL.",
          "execution_kind": "programmatic",
          "validation": { "command_exit_zero": "npx wrangler pages deploy" }
        }
      ]
    },
    {
      "id": "report",
      "title": "Report — git-флоу и отчёт",
      "steps": [
        {
          "title": "Открыть PR (никогда не коммитить в main)",
          "instructions": "Feature-ветка → PR → merge → redeploy. В main напрямую не пушить.",
          "execution_kind": "programmatic",
          "validation": { "pr_opened": true }
        },
        {
          "title": "Сверить отчёт: всего компаний, найдено ИНН, targets, URL",
          "execution_kind": "agent",
          "executor_role": "reviewer",
          "minimum_model_level": "master",
          "context_budget": "small",
          "validation": { "report_numbers_consistent": true }
        }
      ]
    }
  ],
  "hooks": {
    "task_done": [{ "type": "notify", "to": "owner", "text": "Каталог выставки собран и задеплоен: {goal}" }],
    "task_failed": [{ "type": "notify", "to": "owner", "text": "Каталог выставки застрял: {goal} — {error}" }]
  }
}
