{
  "id": "freelance-project-spec",
  "version": 1,
  "scope": "system",
  "title": "Freelance project spec (intake → GO/NO-GO)",
  "goal_template": "{goal}",
  "user_value_template": "Разобранный фриланс-проект: факты/требования/допущения отделены, решение предложено, вердикт GO/NO-GO обоснован, ТЗ (long/short) собрано из одного источника.",
  "defaults": {
    "max_attempts": 3,
    "execution_timeout_seconds": 900,
    "recovery_policy": "default"
  },
  "stages": [
    {
      "id": "intake",
      "title": "Intake — свободное описание проекта",
      "steps": [
        {
          "title": "Зафиксировать сырой ввод как источник (provenance)",
          "instructions": "Принять свободное описание клиента (диалог, файл, скриншот), создать/найти проект и записать сырой ввод в provenance. Сырой ввод — только traceability: он не попадает автоматически ни в requirements, ни в solution.",
          "execution_kind": "agent",
          "executor_role": "researcher",
          "minimum_model_level": "bachelor",
          "context_budget": "small",
          "validation": { "raw_input_logged_as_provenance_only": true }
        }
      ]
    },
    {
      "id": "extract",
      "title": "Extract — факты / требования / допущения",
      "steps": [
        {
          "title": "Разложить ввод по стадиям: факты, требования, допущения",
          "instructions": "Каждый вызов add_info пишет ровно один файл: facts.md (дедуплицированные факты со ссылкой на provenance id), requirements.md (атомарные требования о системе: «Система должна …», без «клиент сказал»), interpretation.md (наши допущения, явно помеченные как допущения). Стадии не смешиваются.",
          "execution_kind": "agent",
          "executor_role": "researcher",
          "minimum_model_level": "master",
          "context_budget": "medium",
          "validation": { "facts_requirements_assumptions_separated": true }
        },
        {
          "title": "Строгая вычитка: диалог не просочился в требования/решение",
          "instructions": "Проверить, что requirements.md не содержит «клиент сказал», хронологии и отсылок к провенансу, а допущения не выданы за подтверждённые факты. Открытые вопросы — в короткий раздел, не в прозу.",
          "execution_kind": "agent",
          "executor_role": "reviewer",
          "minimum_model_level": "master",
          "context_budget": "medium",
          "validation": { "no_dialogue_leak_into_requirements": true }
        }
      ]
    },
    {
      "id": "clarify",
      "title": "Clarify — уточняющие вопросы",
      "steps": [
        {
          "title": "Сформировать релевантные типу проекта уточняющие вопросы",
          "instructions": "Список неясных вопросов по типу проекта; ответы заводятся обычным intake и обновляют соответствующие стадии. qna.md — traceability, в _source.md не входит.",
          "execution_kind": "agent",
          "executor_role": "researcher",
          "minimum_model_level": "bachelor",
          "context_budget": "small",
          "validation": { "clarifying_questions_relevant_to_project_type": true }
        }
      ]
    },
    {
      "id": "solution",
      "title": "Solution — инженерное решение",
      "steps": [
        {
          "title": "Предложить решение, отвечающее на требования",
          "instructions": "Из нормализованного контекста построить solution.md, ответить на каждый существенный пункт requirements.md или явно отложить его, при необходимости дать варианты и компромиссы. Если клиент диктует стек — это требование, а не наше решение; решение вправе согласиться или предложить иначе.",
          "execution_kind": "agent",
          "executor_role": "developer",
          "minimum_model_level": "master",
          "context_budget": "medium",
          "validation": { "requirements_covered_or_explicitly_deferred": true }
        },
        {
          "title": "Критика решения: допущения не выданы за подтверждённые факты",
          "execution_kind": "agent",
          "executor_role": "reviewer",
          "minimum_model_level": "master",
          "context_budget": "medium",
          "validation": { "assumptions_not_presented_as_facts": true }
        }
      ]
    },
    {
      "id": "assess",
      "title": "Assess — вердикт GO/NO-GO",
      "steps": [
        {
          "title": "Прогнать детерминированный risk-engine",
          "instructions": "Прогнать lib/risk-engine.js по сигналам проекта (предоплата, бюджет, срок, объём, тип, отношения с клиентом). Для academic-проектов бизнес-сигналы не применяются. Сохранить risk-assessment.json с signals, score, verdict. Повторный прогон на тех же данных даёт тот же вердикт.",
          "execution_kind": "programmatic",
          "validation": { "file_exists": "risk-assessment.json" }
        },
        {
          "title": "Обосновать вердикт GO/NO-GO и перечислить риски",
          "instructions": "Человекочитаемое обоснование вердикта из risk-assessment.json с явным перечислением рисков. Не переписывать вердикт движка произвольно.",
          "execution_kind": "agent",
          "executor_role": "reviewer",
          "minimum_model_level": "doctor",
          "context_budget": "medium",
          "validation": { "go_no_go_verdict_justified_with_risks": true }
        }
      ]
    },
    {
      "id": "spec",
      "title": "Spec — генерация ТЗ (long/short)",
      "steps": [
        {
          "title": "Собрать нормализованный источник spec/_source.md",
          "instructions": "_source.md — единственный вход для обеих версий. В нём нет «клиент сказал», хронологии и meta-разделов о допущениях.",
          "execution_kind": "programmatic",
          "validation": { "file_exists": "spec/_source.md" }
        },
        {
          "title": "Сгенерировать long и short независимо из одного _source.md",
          "instructions": "long.md — подробная спека для исполнителя; short.md — независимая executive-спека для клиента, не сокращение long. Применить постоянные правила generation.md (профиль и проект).",
          "execution_kind": "agent",
          "executor_role": "developer",
          "minimum_model_level": "master",
          "context_budget": "large",
          "validation": { "long_and_short_generated_independently": true }
        },
        {
          "title": "Проверить спеку: нет утечки диалога, long/short согласованы",
          "execution_kind": "agent",
          "executor_role": "reviewer",
          "minimum_model_level": "doctor",
          "context_budget": "medium",
          "validation": { "spec_free_of_dialogue_and_internally_consistent": true }
        }
      ]
    }
  ],
  "hooks": {
    "task_done": [{ "type": "notify", "to": "owner", "text": "Фриланс-проект разобран: {goal}" }],
    "task_failed": [{ "type": "notify", "to": "owner", "text": "Фриланс-проект застрял: {goal} — {error}" }]
  }
}
